{
  "ir_version": "1.0",
  "ir_id": "ir.monopoly_phase1.v1",
  "source_review_id": "review.monopoly_phase1.v1",
  "phase_scope": "phase1_local_multiplayer",
  "build_steps": [
    {
      "step_id": "step-01-board-layout",
      "ir_action": "create_board_ring_layout",
      "source_families": ["board_topology_spec"],
      "depends_on": [],
      "params": {
        "board_shape": "square_ring",
        "tile_count": 28,
        "tiles_per_side": 7,
        "corner_count": 4,
        "ring_center": {"x": 0, "y": 0, "z": 0},
        "side_length_cm": 700,
        "tile_spacing_cm": 100,
        "corner_tile_size_cm": {"x": 120, "y": 120},
        "normal_tile_size_cm": {"x": 100, "y": 60},
        "level_name": "/Game/Maps/L_MonopolyBoard",
        "board_base_mesh": "/Game/StaticBase/Meshes/SM_BoardBase",
        "tile_base_mesh": "/Game/StaticBase/Meshes/SM_TileSlot"
      },
      "static_base_bindings": ["SM_BoardBase", "SM_TileSlot"],
      "execution_hints": {
        "tool_preference": "python_editor_scripting",
        "estimated_complexity": "moderate"
      }
    },
    {
      "step_id": "step-02-tile-actors",
      "ir_action": "create_tile_actors",
      "source_families": ["board_topology_spec", "tile_system_spec"],
      "depends_on": ["step-01-board-layout"],
      "params": {
        "tile_actor_class": "AMTileActor",
        "tile_count": 28,
        "tile_data_source": "tile_data_table (28 records)",
        "spawn_strategy": "iterate_tile_index_list_and_place_on_ring",
        "actor_naming_pattern": "BP_Tile_{index:02d}_{type}",
        "corner_tiles": [0, 7, 14, 21],
        "property_material_assignment": "color_group → MI_TileColor_{group}"
      },
      "static_base_bindings": ["BP_TileActor", "MI_TileColor_*"],
      "execution_hints": {
        "tool_preference": "python_editor_scripting",
        "estimated_complexity": "moderate"
      }
    },
    {
      "step_id": "step-03-tile-metadata",
      "ir_action": "assign_tile_metadata",
      "source_families": ["tile_system_spec"],
      "depends_on": ["step-02-tile-actors"],
      "params": {
        "data_table_asset": "/Game/Data/DT_TileData",
        "data_table_struct": "FMTileData",
        "fields": {
          "TileIndex": "int32",
          "TileName": "FString",
          "TileType": "EMTileType (enum 8 values)",
          "ColorGroup": "EMColorGroup (enum 8 values, None + 7 groups)",
          "Price": "int32",
          "BaseRent": "int32",
          "TaxAmount": "int32",
          "OwnerIndex": "int32 (-1 = unowned)"
        },
        "row_count": 28,
        "populate_from": "tile_system_spec.tile_data_table"
      },
      "static_base_bindings": ["DT_TileData"],
      "execution_hints": {
        "tool_preference": "cpp_code",
        "estimated_complexity": "simple"
      }
    },
    {
      "step_id": "step-04-player-tokens",
      "ir_action": "create_player_tokens",
      "source_families": ["turn_flow_spec"],
      "depends_on": ["step-01-board-layout"],
      "params": {
        "max_players": 4,
        "token_actor_class": "AMPlayerToken",
        "starting_tile_index": 0,
        "token_meshes": [
          "/Game/StaticBase/Meshes/SM_Token_Red",
          "/Game/StaticBase/Meshes/SM_Token_Blue",
          "/Game/StaticBase/Meshes/SM_Token_Green",
          "/Game/StaticBase/Meshes/SM_Token_Yellow"
        ],
        "spawn_offset_per_player_cm": {"x": 10, "y": 0, "z": 5},
        "movement_animation": "step_by_step_lerp"
      },
      "static_base_bindings": ["SM_Token_*", "BP_PlayerToken"],
      "execution_hints": {
        "tool_preference": "python_editor_scripting",
        "estimated_complexity": "simple"
      }
    },
    {
      "step_id": "step-05-game-mode",
      "ir_action": "create_game_mode_shell",
      "source_families": ["turn_flow_spec", "property_economy_spec"],
      "depends_on": [],
      "params": {
        "game_mode_class": "AMMonopolyGameMode",
        "game_state_class": "AMMonopolyGameState",
        "player_state_class": "AMMonopolyPlayerState",
        "player_controller_class": "AMMonopolyPlayerController",
        "game_state_fields": {
          "CurrentPlayerIndex": "int32",
          "TurnNumber": "int32",
          "ConsecutiveDoublesCount": "int32",
          "GamePhase": "EMGamePhase (WaitingForPlayers, InProgress, GameOver)"
        },
        "player_state_fields": {
          "Money": "int32 (default 1500)",
          "CurrentTileIndex": "int32 (default 0)",
          "IsInJail": "bool (default false)",
          "JailTurnsRemaining": "int32 (default 0)",
          "IsBankrupt": "bool (default false)",
          "OwnedTileIndices": "TArray<int32>"
        },
        "module_name": "Mvpv4TestCodex"
      },
      "static_base_bindings": [],
      "execution_hints": {
        "tool_preference": "cpp_code",
        "estimated_complexity": "moderate"
      }
    },
    {
      "step_id": "step-06-turn-fsm",
      "ir_action": "bind_turn_state_machine",
      "source_families": ["turn_flow_spec"],
      "depends_on": ["step-05-game-mode"],
      "params": {
        "fsm_owner": "AMMonopolyGameMode",
        "initial_state": "WAIT_FOR_ROLL",
        "state_enum": "EMTurnState (10 values)",
        "transition_count": 12,
        "implementation_pattern": "switch_on_enum_in_tick_or_event",
        "key_transitions": [
          {"from": "WAIT_FOR_ROLL", "to": "ROLLING_DICE", "event": "OnPlayerRollRequested"},
          {"from": "ROLLING_DICE",  "to": "MOVING_PAWN",  "event": "OnDiceResultReady"},
          {"from": "TILE_EVENT",    "to": "POST_EVENT",   "event": "OnTileEventResolved"},
          {"from": "POST_EVENT",    "to": "GAME_OVER",    "guard": "CheckGameOver()"},
          {"from": "POST_EVENT",    "to": "DOUBLES_EXTRA_TURN", "guard": "IsDoubles && ConsecutiveDoubles < 3"},
          {"from": "POST_EVENT",    "to": "TURN_END",     "guard": "default"}
        ],
        "player_rotation_logic": "FindNextNonBankruptPlayer()"
      },
      "static_base_bindings": [],
      "execution_hints": {
        "tool_preference": "cpp_code",
        "estimated_complexity": "complex"
      }
    },
    {
      "step_id": "step-07-dice-logic",
      "ir_action": "bind_dice_roll_logic",
      "source_families": ["turn_flow_spec"],
      "depends_on": ["step-06-turn-fsm"],
      "params": {
        "dice_count": 2,
        "dice_sides": 6,
        "result_struct": "FMDiceResult { Die1, Die2, Total, bIsDoubles }",
        "rng_method": "FMath::RandRange(1, 6)",
        "doubles_detection": "Die1 == Die2",
        "consecutive_tracking_field": "GameState->ConsecutiveDoublesCount",
        "triple_doubles_action": "SendToJail()",
        "reset_on_turn_end": true,
        "reset_on_jail_entry": true
      },
      "static_base_bindings": [],
      "execution_hints": {
        "tool_preference": "cpp_code",
        "estimated_complexity": "simple"
      }
    },
    {
      "step_id": "step-08-tile-events",
      "ir_action": "bind_tile_event_dispatch",
      "source_families": ["tile_system_spec", "property_economy_spec"],
      "depends_on": ["step-03-tile-metadata", "step-06-turn-fsm"],
      "params": {
        "dispatch_function": "AMMonopolyGameMode::HandleTileEvent(int32 TileIndex)",
        "dispatch_strategy": "switch_on_tile_type",
        "event_mapping": {
          "PROPERTY_unowned": "ShowBuyPopup() if CanAfford else AutoPass",
          "PROPERTY_owned_other": "CollectRent(Owner, Tenant, EffectiveRent)",
          "PROPERTY_owned_self": "NoAction",
          "TAX": "DeductTax(TaxAmount) or TriggerBankruptcy",
          "GO_TO_JAIL": "SendToJail()",
          "START": "NoAction (bonus handled during movement)",
          "CHANCE": "Phase1Placeholder()",
          "COMMUNITY": "Phase1Placeholder()",
          "JAIL_VISIT": "NoAction",
          "FREE_PARKING": "NoAction"
        }
      },
      "static_base_bindings": [],
      "execution_hints": {
        "tool_preference": "cpp_code",
        "estimated_complexity": "moderate"
      }
    },
    {
      "step_id": "step-09-property-economy",
      "ir_action": "bind_property_economy_logic",
      "source_families": ["property_economy_spec", "tile_system_spec"],
      "depends_on": ["step-03-tile-metadata", "step-05-game-mode"],
      "params": {
        "purchase_function": "TryPurchaseProperty(PlayerState, TileIndex)",
        "rent_function": "CollectRent(OwnerState, TenantState, TileIndex)",
        "rent_calculation": {
          "base": "DT_TileData[TileIndex].BaseRent",
          "color_group_check": "OwnsAllInColorGroup(Owner, ColorGroup)",
          "color_group_multiplier": 2,
          "formula": "BaseRent * (bFullSet ? 2 : 1)"
        },
        "payment_function": "TransferMoney(From, To, Amount) → bool bCanPay",
        "insufficient_funds_action": "TriggerBankruptcy(Player)"
      },
      "static_base_bindings": [],
      "execution_hints": {
        "tool_preference": "cpp_code",
        "estimated_complexity": "moderate"
      }
    },
    {
      "step_id": "step-10-jail-logic",
      "ir_action": "bind_jail_logic",
      "source_families": ["jail_rule_spec", "turn_flow_spec"],
      "depends_on": ["step-06-turn-fsm", "step-07-dice-logic"],
      "params": {
        "send_to_jail_function": "SendToJail(PlayerState)",
        "send_to_jail_actions": [
          "PlayerState->CurrentTileIndex = 7",
          "PlayerState->bIsInJail = true",
          "PlayerState->JailTurnsRemaining = 3",
          "GameState->ConsecutiveDoublesCount = 0"
        ],
        "jail_turn_function": "HandleJailTurn(PlayerState)",
        "bail_cost": 50,
        "pay_bail_flow": "DeductMoney(50) → bIsInJail=false → NormalDiceRollAndMove",
        "try_doubles_flow": "RollDice() → if doubles: FreeFromJail+MoveByTotal, else: Decrement+EndTurn",
        "forced_bail_check": "JailTurnsRemaining == 0 after failed doubles",
        "forced_bail_flow": "PayBail(50) or TriggerBankruptcy"
      },